{
  "$schema": "http://json-schema.org/draft-04/schema#",
  "title": "Fee update schema",
  "uniqueItems": true,
  "minItems": 1,
  "items":  {
    "properties": {
      "idStr": {
        "type": "string",
        "description": "Fee code id"
      },
      "label": {
        "description": "Fee code name",
        "type": "string",
        "minLength": 1,
        "maxLength": 100,
        "pattern":  "^[a-zA-Z0-9]{1,100}$"
      },
      "fee": {
        "type": "number",
        "minimum": 0,
        "maximum": 99999.99,
        "multipleOf":  0.01
      },
      "earlyFee": {
        "type": "number",
        "minimum": 0,
        "maximum": 99999.99,
        "multipleOf": 0.01
      },
      "lateFee": {
        "type": "number",
        "minimum": 0,
        "maximum": 99999.99,
        "multipleOf": 0.01
      },
      "feeScope": {
        "description": "Fee scope",
        "type": "string",
        "enum": [
          "REGISTRANTS",
          "GUESTS",
          "BOTH"
        ]
      },
      "selected": {
        "type": "boolean"
      },
      "restrictedAccess": {
        "type": "boolean"
      }
    },
    "required": [ "idStr", "label", "fee", "earlyFee", "lateFee", "feeScope", "restrictedAccess"],
    "additionalProperties": false
  }
}

